dbn,name,schoolyear,fl_percent,total_enrollment,ell_percent,sped_percent,asian_per,black_per,hispanic_per,white_per,male_per,female_per,Total Grads - % of cohort,Total Regents - % of cohort,Advanced Regents - % of cohort,Regents w/o Advanced - % of cohort,Local - % of cohort,Still Enrolled - % of cohort,Dropped Out - % of cohort
01M292,HENRY STREET SCHOOL FOR INTERNATIONAL STUDIES,20082009,95.3,470,10.6,25.1,10.0,29.4,56.2,3.0,56.2,43.8,67.3,30.9,0.0,30.9,36.4,27.3,5.5
01M448,UNIVERSITY NEIGHBORHOOD HIGH SCHOOL,20082009,60.9,586,6.7,21.7,19.3,23.5,47.8,4.3,52.4,47.6,67.0,32.1,5.4,26.8,34.8,29.5,3.6
01M450,EAST SIDE COMMUNITY HIGH SCHOOL,20082009,67.7,546,4.9,26.7,6.2,26.6,59.7,6.0,52.2,47.8,72.5,60.0,0.0,60.0,12.5,16.3,11.3
01M509,MARTA VALLE SECONDARY SCHOOL,20082009,81.5,441,12.9,18.4,11.8,17.7,68.7,1.8,52.2,47.8,44.6,20.0,4.6,15.4,24.6,41.5,12.3
01M515,LOWER EAST SIDE PREPARATORY HIGH SCHOOL,20082009,77.0,514,87.5,0.6,93.2,3.3,3.1,0.4,52.9,47.1,48.5,37.0,30.0,7.0,11.5,39.0,12.5
01M539,NEW EXPLORATIONS INTO SCIENCE TECH AND MATH,20082009,12.6,1302,0.2,3.8,21.8,11.2,16.6,49.4,48.0,52.0,96.7,96.7,90.0,6.7,0.0,0.0,3.3
01M650,CASCADES HIGH SCHOOL,20082009,63.8,215,6.0,5.1,4.2,33.0,56.7,5.6,34.4,65.6,41.8,14.9,0.0,14.9,26.9,46.3,10.4
01M696,BARD HIGH SCHOOL EARLY COLLEGE,20082009,17.9,575,0.0,0.5,13.2,17.7,18.8,41.6,33.0,67.0,92.3,92.3,0.0,92.3,0.0,6.8,0.9
02M288,FOOD AND FINANCE HIGH SCHOOL,20082009,65.9,433,3.7,18.0,2.3,46.2,46.7,3.9,43.4,56.6,66.3,62.5,0.0,62.5,3.8,13.8,20.0
02M294,HIGH SCHOOL FOR HISTORY & COMMUNICATION,20082009,62.8,353,6.8,17.3,5.1,30.6,55.2,8.2,51.8,48.2,84.4,50.0,0.0,50.0,34.4,10.4,5.2
02M296,HIGH SCHOOL OF HOSPITALITY MANAGEMENT,20082009,67.1,389,5.7,12.1,5.4,34.2,57.6,2.6,28.5,71.5,72.8,48.1,0.0,48.1,24.7,18.5,8.6
02M298,PACE HIGH SCHOOL,20082009,42.2,410,2.2,12.7,19.8,29.8,39.5,6.1,46.6,53.4,85.2,85.2,35.7,49.6,0.0,7.0,6.1
02M300,URBAN ASSEMBLY SCHOOL OF DESIGN AND CONSTRUCTION,20082009,53.7,384,8.1,13.5,4.4,25.0,65.1,4.9,74.7,25.3,68.7,63.9,2.4,61.4,4.8,25.3,6.0
02M313,THE JAMES BALDWIN SCHOOL: A SCHOOL FOR EXPEDITIO,20082009,43.6,247,5.3,16.6,3.2,38.5,47.4,9.3,51.4,48.6,29.5,15.9,0.0,15.9,13.6,56.8,9.1
02M400,HIGH SCHOOL FOR ENVIRONMENTAL STUDIES,20082009,43.1,1491,5.5,11.3,16.9,19.5,51.0,12.3,49.4,50.6,79.5,68.0,32.0,36.0,11.4,15.8,3.7
02M407,INSTITUTE FOR COLLABORATIVE EDUCATION,20082009,13.4,439,0.7,9.3,9.6,20.5,22.1,46.0,52.6,47.4,66.0,0.0,0.0,0.0,66.0,30.0,4.0
02M408,PROFESSIONAL PERFORMING ARTS HIGH SCHOOL,20082009,14.0,449,0.2,4.0,3.8,28.1,18.0,47.7,26.5,73.5,1.2,0.0,0.0,0.0,1.2,97.5,1.2
02M411,BARUCH COLLEGE CAMPUS HIGH SCHOOL,20082009,53.6,419,0.0,1.9,58.0,7.6,10.7,23.4,38.9,61.1,97.1,95.2,62.5,32.7,1.9,1.9,1.0
02M412,NYC LAB SCHOOL FOR COLLABORATIVE STUDIES,20082009,13.6,536,0.2,14.9,28.4,9.3,14.2,46.8,48.9,51.1,97.1,90.2,55.9,34.3,6.9,2.0,1.0
02M413,SCHOOL OF THE FUTURE HIGH SCHOOL,20082009,27.3,687,0.6,16.4,15.3,22.6,28.1,33.3,46.6,53.4,78.09999999999998,78.09999999999998,0.0,78.09999999999998,0.0,21.9,0.0
02M414,NYC MUSEUM SCHOOL,20082009,37.4,442,1.4,11.1,24.7,19.0,38.2,17.4,47.5,52.5,92.0,77.3,8.0,69.3,14.7,4.0,4.0
02M416,ELEANOR ROOSEVELT HIGH SCHOOL,20082009,23.6,506,,2.0,20.9,8.1,12.1,58.1,35.4,64.6,100.0,96.2,65.7,30.5,3.8,0.0,0.0
02M418,MILLENNIUM HIGH SCHOOL,20082009,32.7,573,0.2,9.6,27.4,13.1,23.9,33.9,37.5,62.5,96.2,84.8,21.0,63.8,11.4,1.9,1.9
02M419,LANDMARK HIGH SCHOOL,20082009,65.0,440,9.8,15.9,1.4,23.2,72.7,2.7,46.6,53.4,52.0,0.0,0.0,0.0,52.0,33.0,12.0
02M420,HIGH SCHOOL FOR HEALTH PROFESSIONS AND HUMAN SER,20082009,65.1,1620,3.5,7.2,20.7,24.3,48.6,6.0,30.3,69.7,77.0,63.6,17.8,45.7,13.4,21.6,0.4
02M425,LEADERSHIP AND PUBLIC SERVICE HIGH SCHOOL,20082009,51.2,663,3.5,15.1,8.3,29.9,56.3,4.8,49.3,50.7,59.6,29.8,6.6,23.2,29.8,14.6,19.2
02M429,LEGACY SCHOOL FOR INTEGRATED STUDIES,20082009,71.8,380,3.4,18.7,3.9,46.1,45.8,3.2,47.4,52.6,38.0,4.2,0.0,4.2,33.8,26.8,33.8
02M439,MANHATTAN VILLAGE ACADEMY,20082009,64.0,393,2.0,9.2,6.6,28.0,59.3,5.1,35.1,64.9,89.7,73.59999999999998,8.0,65.5,16.1,4.6,4.6
02M440,BAYARD RUSTIN EDUCATIONAL COMPLEX,20082009,64.5,1507,22.0,12.7,8.2,29.3,58.1,2.9,49.8,50.2,48.2,12.9,4.6,8.4,35.3,30.9,18.7
02M449,VANGUARD HIGH SCHOOL,20082009,66.3,436,6.7,17.7,3.9,32.1,57.1,5.3,44.7,55.3,47.1,44.1,0.0,44.1,2.9,38.2,7.4
02M459,MANHATTAN INTERNATIONAL HIGH SCHOOL,20082009,86.2,308,60.7,0.3,25.3,14.9,43.2,16.2,50.6,49.4,63.6,47.0,0.0,47.0,16.7,30.3,6.1
02M460,WASHINGTON IRVING HIGH SCHOOL,20082009,60.9,1676,20.9,12.3,3.9,31.6,61.8,1.7,46.0,54.0,36.6,16.8,3.9,12.9,19.7,35.9,24.5
02M475,STUYVESANT HIGH SCHOOL,20082009,22.3,3245,0.0,0.3,67.3,2.0,3.1,27.5,58.2,41.8,97.8,97.8,97.1,0.7,0.0,2.0,0.1
02M489,HIGH SCHOOL OF ECONOMICS AND FINANCE,20082009,60.8,823,3.6,12.4,27.9,24.2,36.8,10.4,55.0,45.0,78.8,54.1,23.3,30.8,24.7,13.0,8.2
02M500,UNITY CENTER FOR URBAN TECHNOLOGIES,20082009,87.2,183,12.0,23.0,2.2,37.7,59.0,0.5,60.1,39.9,52.5,30.0,0.0,30.0,22.5,40.0,7.5
02M519,TALENT UNLIMITED HIGH SCHOOL,20082009,39.8,438,0.5,3.7,2.5,36.8,38.6,20.3,23.3,76.7,86.2,71.3,38.3,33.0,14.9,11.7,2.1
02M520,MURRY BERGTRAUM HIGH SCHOOL FOR BUSINESS CAREERS,20082009,60.7,2749,11.6,11.8,14.5,32.2,50.1,2.6,49.5,50.5,50.1,35.7,25.5,10.1,14.4,29.1,19.1
02M529,JACQUELINE KENNEDY ONASSIS HIGH SCHOOL,20082009,53.1,723,6.4,13.7,5.5,25.7,63.1,5.3,38.2,61.8,64.2,48.5,36.6,11.9,15.7,23.1,11.9
02M531,REPERTORY COMPANY HIGH SCHOOL FOR THEATRE ARTS,20082009,56.9,215,1.4,8.8,2.3,43.7,45.6,7.9,24.7,75.3,87.5,42.5,0.0,42.5,45.0,10.0,2.5
02M542,MANHATTAN BRIDGES HIGH SCHOOL,20082009,83.5,475,82.9,0.2,0.0,0.6,99.2,0.0,51.6,48.4,76.59999999999998,39.4,25.5,13.8,37.2,19.1,2.1
02M543,NEW DESIGN HIGH SCHOOL,20082009,77.4,408,6.1,17.9,4.2,32.6,59.3,2.7,40.7,59.3,70.3,50.5,0.0,50.5,19.8,16.5,9.9
02M544,INDEPENDENCE HIGH SCHOOL,20082009,67.4,414,5.8,6.5,2.9,38.6,55.3,2.2,45.2,54.8,21.7,7.0,0.0,7.0,14.8,70.4,7.0
02M545,HIGH SCHOOL FOR DUAL LANGUAGE & ASIAN STUDIES,20082009,82.6,294,56.1,1.4,86.7,5.8,5.1,1.7,51.4,48.6,77.8,72.2,62.5,9.7,5.6,19.4,2.8
02M550,LIBERTY HIGH SCHOOL ACADEMY FOR NEWCOMERS,20082009,79.5,410,80.2,3.9,28.8,17.8,34.1,18.8,62.4,37.6,43.4,34.9,8.5,26.4,8.5,29.2,27.4
02M551,NEW YORK HARBOR SCHOOL,20082009,73.5,394,12.9,13.2,1.5,32.2,61.7,2.3,58.4,41.6,68.0,30.1,11.7,18.4,37.9,24.3,6.8
02M560,HIGH SCHOOL M560  CITY AS SCHOOL,20082009,26.4,720,1.5,12.5,4.4,39.7,40.6,14.3,49.4,50.6,37.6,21.5,0.0,21.5,16.1,59.5,2.9
02M565,URBAN ACADEMY LABORATORY HIGH SCHOOL,20082009,35.5,147,,2.0,2.0,35.4,27.9,29.3,38.8,61.2,42.3,42.3,0.0,42.3,0.0,53.8,3.8
02M570,SATELLITE ACADEMY HIGH SCHOOL,20082009,64.4,901,1.7,5.5,3.2,40.1,53.4,3.1,45.2,54.8,19.0,1.0,0.0,1.0,18.1,76.8,3.5
02M575,MANHATTAN COMPREHENSIVE NIGHT AND DAY HIGH SCHOO,20082009,91.4,772,63.5,2.2,33.7,35.1,23.8,6.7,54.3,45.7,44.2,37.9,14.5,23.4,6.3,38.3,17.5
02M580,RICHARD R. GREEN HIGH SCHOOL OF TEACHING,20082009,70.0,618,5.2,14.9,4.0,35.9,55.5,2.6,31.7,68.3,56.3,33.6,12.6,21.0,22.7,22.7,19.3
02M586,HARVEY MILK HIGH SCHOOL,20082009,68.2,93,2.2,16.1,2.2,41.9,49.5,6.5,46.2,53.8,15.0,5.0,0.0,5.0,10.0,65.0,17.5
02M600,THE HIGH SCHOOL OF FASHION INDUSTRIES,20082009,63.1,1682,2.7,9.8,4.0,38.2,51.6,5.1,8.7,91.3,85.1,53.2,38.8,14.4,31.9,9.5,3.4
02M605,HUMANITIES PREPARATORY ACADEMY,20082009,47.7,177,0.6,10.7,6.2,32.2,51.4,9.6,46.3,53.7,45.1,43.1,13.7,29.4,2.0,43.1,11.8
02M615,CHELSEA CAREER AND TECHNICAL EDUCATION HIGH SCHO,20082009,72.8,768,5.3,13.9,2.9,35.4,59.1,1.8,62.2,37.8,48.4,27.4,12.6,14.9,20.9,32.1,14.9
02M620,NORMAN THOMAS HIGH SCHOOL,20082009,68.7,2137,17.6,13.1,2.9,25.8,69.6,1.3,51.1,48.9,35.4,15.9,8.1,7.9,19.4,42.0,20.8
02M625,HIGH SCHOOL OF GRAPHIC COMMUNICATION ARTS,20082009,73.1,1788,9.8,16.4,2.0,36.1,59.2,2.5,49.7,50.3,32.7,22.0,1.3,20.6,10.7,35.1,30.3
02M630,ART AND DESIGN HIGH SCHOOL,20082009,44.0,1384,2.5,10.6,6.8,27.2,54.8,10.5,52.2,47.8,68.3,46.6,7.1,39.6,21.6,24.6,5.6
02M655,LIFE SCIENCES SECONDARY SCHOOL,20082009,62.6,686,5.1,15.7,2.3,29.9,65.0,1.6,50.0,50.0,83.1,53.8,15.4,38.5,29.2,8.5,8.5
02M690,SCHOOL FOR THE PHYSICAL CITY HIGH SCHOOL,20082009,62.9,123,8.9,17.9,8.1,30.9,55.3,4.9,49.6,50.4,37.5,15.6,0.0,15.6,21.9,35.9,26.6
03M283,MANHATTAN THEATRE LAB HIGH SCHOOL,20082009,64.1,384,4.4,13.0,1.0,54.7,42.2,0.8,38.5,61.5,50.0,14.3,1.8,12.5,35.7,33.9,16.1
03M307,THE URBAN ASSEMBLY SCHOOL FOR MEDIA STUDIES,20082009,64.6,361,6.4,15.8,1.1,40.4,51.5,5.5,55.7,44.3,59.5,41.8,0.0,41.8,17.7,32.9,6.3
03M415,WADLEIGH SECONDARY SCHOOL FOR THE PERFORMING & V,20082009,76.6,606,5.1,14.2,0.8,66.3,32.0,0.2,48.2,51.8,61.0,37.1,4.4,32.7,23.9,27.7,1.3
03M470,LOUIS D. BRANDEIS HIGH SCHOOL,20082009,68.6,2249,31.7,10.3,2.0,28.6,67.5,1.4,48.8,51.2,32.4,18.3,3.0,15.3,14.1,38.0,25.7
03M479,BEACON HIGH SCHOOL,20082009,15.1,1130,0.4,5.0,6.6,15.0,21.2,54.1,40.2,59.8,85.5,74.4,0.0,74.4,11.0,12.8,1.8
03M485,FIORELLO H. LAGUARDIA HIGH SCHOOL OF MUSIC & ART,20082009,15.0,2501,0.2,1.1,19.4,16.5,17.7,46.0,24.9,75.1,95.4,94.3,62.7,31.6,1.1,4.2,0.3
03M492,HIGH SCHOOL FOR LAW ADVOCACY AND COMMUNITY JUSTI,20082009,65.7,486,12.3,15.2,3.1,47.5,45.3,2.7,41.6,58.4,57.5,34.9,4.7,30.2,22.6,21.7,19.8
03M494,HIGH SCHOOL OF ARTS AND TECHNOLOGY,20082009,71.6,605,9.4,16.0,3.5,37.4,55.5,2.1,66.3,33.7,59.4,40.0,6.5,33.5,19.4,20.0,20.0
03M505,EDWARD A.REYNOLDS WEST SIDE HIGH  SCHOOL,20082009,68.1,605,6.4,15.7,0.8,35.7,61.7,1.3,44.1,55.9,24.4,3.6,0.0,3.6,20.8,57.4,16.8
03M541,MANHATTAN/HUNTER SCIENCE HIGH SCHOOL,20082009,49.3,435,1.4,3.2,29.0,22.1,38.6,9.7,46.0,54.0,93.2,88.9,35.0,53.8,4.3,6.0,0.9
03M860,FREDERICK DOUGLASS ACADEMY II SECONDARY SCHOOL,20082009,57.1,462,2.8,18.2,0.4,78.8,20.8,0.0,53.9,46.1,71.6,58.2,17.9,40.3,13.4,20.9,7.5
04M435,MANHATTAN CENTER FOR SCIENCE AND MATHEMATICS,20082009,63.5,1675,5.0,8.2,20.3,20.8,54.7,3.2,48.2,51.8,78.0,69.3,52.1,17.3,8.6,12.8,4.8
04M495,PARK EAST HIGH SCHOOL,20082009,77.7,375,6.7,14.7,1.6,41.1,53.3,2.4,40.3,59.7,79.2,40.3,1.4,38.9,38.9,16.7,4.2
04M555,CENTRAL PARK EAST SECONDARY HIGH SCHOOL,20082009,70.4,328,7.9,16.2,3.7,35.7,57.0,3.0,46.6,53.4,52.2,26.9,0.0,26.9,25.4,32.8,11.9
04M610,YOUNG WOMEN'S LEADERSHIP SCHOOL,20082009,63.3,423,1.2,5.9,3.1,35.7,57.4,1.2,0.0,100.0,94.1,80.4,15.7,64.7,13.7,5.9,0.0
04M635,ACADEMY OF ENVIRONMENTAL SCIENCE SECONDARY HIGH,20082009,65.8,558,8.6,18.8,1.8,31.9,64.5,0.5,55.2,44.8,48.3,20.2,0.0,20.2,28.1,30.3,19.1
04M680,THE HERITAGE SCHOOL,20082009,69.9,342,5.6,23.7,0.6,28.7,68.4,2.0,52.3,47.7,57.6,30.5,6.8,23.7,27.1,27.1,11.9
04M695,URBAN PEACE ACADEMY,20082009,67.7,96,3.1,12.5,1.0,53.1,42.7,2.1,39.6,60.4,59.1,25.0,0.0,25.0,34.1,20.5,15.9
05M285,HARLEM RENAISSANCE HIGH SCHOOL,20082009,68.2,180,0.0,7.8,0.0,64.4,32.8,1.7,50.6,49.4,3.9,1.3,0.0,1.3,2.6,67.5,28.6
05M304,MOTT HALL HIGH SCHOOL,20082009,61.3,405,5.9,14.1,0.5,37.3,60.0,2.2,49.4,50.6,64.7,62.4,3.5,58.8,2.4,31.8,3.5
05M469,CHOIR ACADEMY OF HARLEM,20082009,66.3,387,3.6,12.1,0.0,76.7,21.7,0.5,34.6,65.4,62.1,29.3,3.4,25.9,32.8,32.8,5.2
05M499,FREDERICK DOUGLASS ACADEMY,20082009,53.4,1520,1.0,5.5,1.4,73.4,24.5,0.5,48.7,51.3,67.8,64.9,20.2,44.7,2.9,26.9,5.3
05M670,THURGOOD MARSHALL ACADEMY FOR LEARNING AND SOCIA,20082009,63.7,583,2.1,9.6,1.5,71.0,26.1,0.9,46.1,53.9,73.9,42.0,0.0,42.0,31.8,17.0,3.4
05M685,BREAD & ROSES INTEGRATED ARTS HIGH SCHOOL,20082009,62.6,526,12.0,17.7,0.4,50.8,48.1,0.4,47.9,52.1,47.3,31.9,0.0,31.9,15.4,35.2,15.4
05M692,HIGH SCHOOL FOR MATHEMATICS SCI AND ENGINEERING,20082009,18.5,449,0.4,1.3,25.8,16.9,29.8,20.9,64.1,35.9,98.3,98.3,86.4,11.9,0.0,1.7,0.0
06M462,HIGH SCHOOL FOR INTERNATIONAL BUSINESS AND FINAN,20082009,88.9,678,33.2,11.2,0.4,7.7,90.4,1.0,57.2,42.8,70.4,45.4,7.9,37.5,25.0,10.5,8.6
06M463,HIGH SCHOOL FOR MEDIA AND COMMUNICATIONS,20082009,84.3,639,25.0,9.5,0.5,5.6,93.6,0.2,60.9,39.1,64.8,38.9,6.5,32.4,25.9,23.1,10.2
06M467,HIGH SCHOOL FOR LAW AND PUBLIC SERVICE,20082009,73.8,689,23.1,11.5,0.7,8.3,89.8,1.2,50.8,49.2,70.9,47.3,7.3,40.0,23.6,15.5,9.1
06M468,HIGH SCHOOL FOR HEALTH CAREERS AND SCIENCES,20082009,84.6,670,29.1,11.3,0.3,7.5,91.2,0.9,49.0,51.0,65.9,34.1,5.6,28.6,31.7,19.8,11.1
06M540,A. PHILIP RANDOLPH CAMPUS HIGH SCHOOL,20082009,62.8,1370,2.5,6.5,3.4,33.7,62.0,0.5,46.9,53.1,58.7,47.4,12.1,35.3,11.2,27.9,12.4
06M552,GREGORIO LUPERON HIGH SCHOOL FOR SCIENCE AND MAT,20082009,88.0,409,87.3,0.0,0.0,0.0,100.0,0.0,44.3,55.7,79.0,40.7,4.9,35.8,38.3,11.1,9.9
07X221,SOUTH BRONX PREPARATORY: A COLLEGE BOARD SCHOOL,20082009,72.9,590,6.1,18.5,1.2,33.9,63.7,0.7,46.1,53.9,73.2,33.8,2.8,31.0,39.4,12.7,9.9
07X321,CROTONA ACADEMY HIGH SCHOOL,20082009,65.1,146,6.8,8.2,2.7,44.5,52.1,0.7,37.0,63.0,12.8,8.5,0.0,8.5,4.3,76.59999999999998,10.6
07X379,JILL CHAIFETZ TRANSFER HIGH SCHOOL,20082009,76.8,131,3.1,6.9,0.8,53.4,44.3,0.8,46.6,53.4,11.4,0.0,0.0,0.0,11.4,81.8,6.8
07X427,COMMUNITY SCHOOL FOR SOCIAL JUSTICE,20082009,86.6,347,6.9,17.6,0.0,40.1,57.3,1.4,41.5,58.5,72.09999999999998,25.6,0.0,25.6,46.5,14.0,12.8
07X473,MOTT HAVEN VILLAGE PREPARATORY HIGH SCHOOL,20082009,82.5,333,9.6,16.8,0.9,26.4,72.4,0.0,51.4,48.6,76.8,30.4,0.0,30.4,46.4,17.4,5.8
07X500,HOSTOSLINCOLN ACADEMY OF SCIENCE,20082009,64.7,517,5.8,12.8,2.5,27.3,69.8,0.4,43.9,56.1,85.0,68.2,44.9,23.4,16.8,12.1,2.8
07X520,FOREIGN LANGUAGE ACADEMY OF GLOBAL STUDIES,20082009,77.8,491,10.4,17.1,2.4,23.2,72.3,1.2,44.2,55.8,64.6,42.7,3.1,39.6,21.9,16.7,10.4
07X527,BRONX LEADERSHIP ACADEMY II HIGH SCHOOL,20082009,68.2,453,11.0,17.9,1.1,37.7,58.9,0.9,51.0,49.0,70.7,49.5,9.1,40.4,21.2,20.2,7.1
07X547,NEW EXPLORERS HIGH SCHOOL,20082009,81.8,320,5.6,16.3,0.0,36.3,62.8,0.6,60.9,39.1,54.4,12.7,0.0,12.7,41.8,24.1,10.1
07X548,ACADEMY FOR CAREERS IN SPORTS,20082009,71.2,324,4.0,12.7,0.9,28.7,69.1,0.3,84.3,15.7,92.9,47.1,5.7,41.4,45.7,5.7,1.4
07X551,BRONX ACADEMY OF LETTERS,20082009,75.2,502,8.8,18.1,1.8,36.9,60.4,0.6,38.8,61.2,80.3,72.7,4.5,68.2,7.6,16.7,3.0
07X600,ALFRED E. SMITH CAREER AND TECHNICAL EDUCATION H,20082009,71.5,1176,9.3,18.5,2.6,34.0,62.5,0.5,89.2,10.8,33.3,22.9,14.9,8.0,10.4,30.1,35.3
07X655,SAMUEL GOMPERS CAREER AND TECHNICAL EDUCATION HI,20082009,71.4,1300,14.8,20.8,1.3,28.4,68.6,0.8,77.2,22.8,48.9,35.8,3.2,32.6,13.1,25.9,16.9
07X670,HEALTH OPPORTUNITIES HIGH SCHOOL,20082009,74.2,641,6.4,13.9,2.0,36.7,60.8,0.5,28.9,71.1,56.9,35.0,5.8,29.2,21.9,27.7,14.6
08X293,RENAISSANCE HIGH SCHOOL OF MUSICAL THEATER & TEC,20082009,63.4,442,2.5,16.1,2.3,33.0,61.1,2.3,35.7,64.3,70.5,60.0,4.2,55.8,10.5,18.9,10.5
08X295,GATEWAY SCHOOL FOR ENVIRONMENTAL RESEARCH AND TE,20082009,64.8,474,12.0,16.0,4.9,36.7,57.6,0.8,63.3,36.7,67.8,35.6,2.3,33.3,32.2,19.5,12.6
08X305,PABLO NERUDA ACADEMY FOR ARCHITECTURE AND WORLD,20082009,73.5,380,18.9,22.1,1.3,26.1,71.8,0.5,63.4,36.6,57.9,18.4,0.0,18.4,39.5,26.3,15.8
08X312,MILLENNIUM ART ACADEMY,20082009,68.8,487,6.4,16.6,1.0,36.8,60.4,1.8,55.4,44.6,62.8,33.0,0.0,33.0,29.8,30.9,6.4
08X377,BRONX COMMUNITY HIGH SCHOOL,20082009,82.7,203,3.0,11.3,0.0,35.5,63.5,1.0,38.9,61.1,6.9,0.0,0.0,0.0,6.9,89.7,3.4
08X405,HERBERT LEHMAN HIGH SCHOOL,20082009,66.8,4089,7.6,15.7,5.9,22.7,60.7,9.7,59.8,40.2,42.8,28.2,12.5,15.8,14.5,36.0,19.4
08X450,ADLAI E. STEVENSON HIGH SCHOOL,20082009,61.6,292,21.9,20.9,2.7,32.9,62.0,2.1,49.7,50.3,21.6,8.1,0.0,8.1,13.4,39.5,34.2
08X452,BRONX GUILD: A NEW YORK CITY OUTWARD BOUND SCHOO,20082009,69.2,305,8.2,20.7,3.6,35.7,59.7,0.7,43.9,56.1,58.0,11.1,0.0,11.1,46.9,30.9,8.6
08X519,THE FELISA RINCON DE GAUTIER INSTITUTE FOR LAW A,20082009,73.2,410,11.7,15.6,1.7,24.1,72.0,1.2,39.3,60.7,45.1,21.6,0.0,21.6,23.5,34.3,19.6
08X530,BANANA KELLY HIGH SCHOOL,20082009,81.9,465,13.3,16.6,1.9,31.0,65.6,0.6,43.0,57.0,36.6,14.6,0.0,14.6,22.0,41.5,22.0
08X540,SCHOOL FOR COMMUNITY RESEARCH AND LEARNING,20082009,81.8,375,13.6,22.1,2.4,33.1,63.5,0.8,48.8,51.2,40.4,14.6,1.1,13.5,25.8,36.0,14.6
08X560,BRONX ACADEMY HIGH SCHOOL,20082009,82.0,400,6.0,8.0,0.5,43.3,55.0,0.3,45.5,54.5,16.3,3.3,0.0,3.3,13.1,76.5,6.5
08X650,JANE ADDAMS HIGH SCHOOL FOR ACADEMIC CAREERS,20082009,55.5,1487,10.0,17.2,1.5,33.8,63.1,0.6,30.2,69.8,44.4,20.9,9.2,11.7,23.5,23.2,29.3
08X686,NEW SCHOOL FOR ARTS AND SCIENCE,20082009,84.1,80,8.8,18.8,2.5,42.5,55.0,0.0,57.5,42.5,56.1,37.8,0.0,37.8,18.3,8.5,24.4
09X227,BRONX EXPEDITIONARY LEARNING HIGH SCHOOL,20082009,74.4,411,21.2,17.3,0.2,32.8,64.2,1.2,50.4,49.6,51.3,22.5,1.3,21.3,28.8,33.8,8.8
09X231,EAGLE ACADEMY FOR YOUNG MEN,20082009,62.8,422,3.1,14.7,1.2,65.2,32.5,0.9,100.0,0.0,66.7,28.6,1.2,27.4,38.1,27.4,3.6
09X239,THE URBAN ASSEMBLY ACADEMY FOR HISTORY AND CITIZ,20082009,69.3,309,11.3,19.1,0.0,52.4,46.3,1.0,100.0,0.0,52.9,10.0,0.0,10.0,42.9,32.9,11.4
09X297,MORRIS ACADEMY FOR COLLABORATIVE STUDIES,20082009,79.1,432,15.0,21.3,0.5,34.7,63.0,1.6,49.3,50.7,68.9,10.0,0.0,10.0,58.9,21.1,3.3
09X403,BRONX INTERNATIONAL HIGH SCHOOL,20082009,82.3,347,83.0,6.3,2.0,22.2,72.9,2.6,47.6,52.4,68.2,31.8,0.0,31.8,36.4,25.8,4.5
09X404,SCHOOL FOR EXCELLENCE,20082009,81.4,450,12.9,18.9,0.0,39.3,59.3,0.7,51.1,48.9,75.0,22.8,0.0,22.8,52.2,15.2,7.6
09X412,BRONX HIGH SCHOOL OF BUSINESS,20082009,69.6,468,17.5,17.5,1.9,33.3,63.7,0.4,54.5,45.5,45.4,38.0,12.0,25.9,7.4,36.1,16.7
09X413,BRONX HIGH SCHOOL FOR MEDICAL SCIENCE,20082009,71.2,487,4.9,6.4,7.2,43.7,47.2,0.8,34.9,65.1,83.3,66.7,16.7,50.0,16.7,14.3,2.4
09X414,JONATHAN LEVIN HIGH SCHOOL FOR MEDIA AND COMMUNI,20082009,68.3,457,25.8,18.6,0.9,26.9,71.3,0.7,51.4,48.6,57.5,34.2,0.0,34.2,23.3,34.2,4.1
09X505,BRONX SCHOOL FOR LAW GOVERNMENT AND JUSTICE,20082009,66.4,602,4.0,13.0,3.0,33.9,60.3,1.8,39.9,60.1,68.5,47.2,3.9,43.3,21.3,18.1,11.8
09X517,FREDERICK DOUGLASS ACADEMY III SECONDARY SCHOOL,20082009,70.0,552,7.2,9.8,0.5,58.7,40.2,0.5,45.1,54.9,87.9,56.1,1.5,54.5,31.8,7.6,4.5
09X525,BRONX LEADERSHIP ACADEMY HIGH SCHOOL,20082009,70.1,662,6.2,15.7,1.4,43.2,54.4,0.5,40.9,59.1,62.2,39.9,2.1,37.8,22.4,24.5,9.1
09X543,HIGH SCHOOL FOR VIOLIN AND DANCE,20082009,88.4,201,8.0,18.9,0.0,35.3,62.2,0.0,10.9,89.1,79.2,35.4,0.0,35.4,43.8,14.6,6.3
10X141,RIVERDALE/KINGSBRIDGE ACADEMY (MS/HS 141),20082009,38.1,1278,5.2,14.9,10.4,13.1,48.3,27.3,50.2,49.8,81.4,61.4,17.9,43.6,20.0,14.3,2.9
10X213,BRONX ENGINEERING AND TECHNOLOGY ACADEMY,20082009,77.6,372,10.5,18.8,2.7,37.4,56.5,2.2,81.5,18.5,88.7,87.1,11.3,75.8,1.6,1.6,3.2
10X237,THE MARIE CURIE SCHOOL FOR MEDICINE,20082009,84.1,405,9.6,13.3,2.5,27.9,66.7,1.7,19.5,80.5,89.0,67.1,0.0,67.1,22.0,9.8,1.2
10X243,WEST BRONX ACADEMY FOR THE FUTURE,20082009,82.5,567,11.3,15.3,3.7,34.7,60.5,0.5,58.2,41.8,28.8,12.3,0.0,12.3,16.4,47.9,21.9
10X284,BRONX SCHOOL OF LAW AND FINANCE,20082009,81.1,437,4.6,11.2,2.3,39.8,54.7,2.7,44.6,55.4,75.9,59.5,8.9,50.6,16.5,17.7,6.3
10X319,PROVIDING URBAN LEARNERS SUCCESS IN EDUCATION HI,20082009,71.1,200,5.5,8.0,0.5,35.0,62.5,1.0,39.5,60.5,50.0,5.6,0.0,5.6,44.4,38.9,11.1
10X368,INTECH ACADEMY (MS/HS 368),20082009,77.2,1010,12.5,16.5,4.3,14.1,78.5,2.5,53.2,46.8,59.1,25.5,2.7,22.7,33.6,25.5,14.5
10X433,HIGH SCHOOL FOR TEACHING AND THE PROFESSIONS,20082009,93.3,517,13.2,14.9,1.4,34.0,61.5,2.1,39.1,60.9,57.7,27.9,5.4,22.5,29.7,26.1,15.3
10X434,BELMONT PREPARATORY HIGH SCHOOL,20082009,79.8,398,17.1,18.3,1.8,34.7,62.1,1.3,48.5,51.5,58.0,30.7,9.1,21.6,27.3,26.1,15.9
10X437,FORDHAM HIGH SCHOOL FOR THE ARTS,20082009,72.8,389,7.7,17.7,1.8,41.9,53.7,2.6,40.1,59.9,56.6,41.0,0.0,41.0,15.7,20.5,20.5
10X438,FORDHAM LEADERSHIP ACADEMY FOR BUSINESS AND TECH,20082009,79.0,522,12.5,14.4,2.7,36.4,58.6,1.3,59.0,41.0,39.5,26.6,1.6,25.0,12.9,35.5,23.4
10X439,BRONX HIGH SCHOOL FOR LAW AND COMMUNITY SERVICE,20082009,82.7,440,10.0,18.6,2.3,40.2,56.4,0.7,40.7,59.3,34.2,21.1,1.3,19.7,13.2,32.9,31.6
10X440,DEWITT CLINTON HIGH SCHOOL,20082009,61.6,4388,19.8,11.5,6.0,26.0,64.8,2.4,48.1,51.9,51.5,39.0,14.3,24.7,12.6,33.5,12.6
10X442,THE CELIA CRUZ BRONX HIGH SCHOOL OF MUSIC,20082009,69.6,364,4.4,9.1,0.5,29.9,67.9,1.4,38.5,61.5,58.3,34.7,4.2,30.6,23.6,37.5,4.2
10X445,BRONX HIGH SCHOOL OF SCIENCE,20082009,12.6,2808,0.0,0.3,61.4,4.1,7.5,26.7,56.4,43.6,98.3,98.3,97.5,0.8,0.0,1.3,0.3
10X475,JOHN F. KENNEDY HIGH SCHOOL,20082009,64.3,1617,23.6,19.5,1.7,31.2,63.9,2.8,64.4,35.6,45.4,13.5,1.7,11.8,31.9,33.2,16.2
10X660,GRACE DODGE CAREER AND TECHNICAL EDUCATION HIGH,20082009,71.0,1483,14.8,15.9,1.3,32.1,63.9,1.8,37.0,63.0,36.3,21.1,3.9,17.2,15.2,31.6,28.9
10X477,MARBLE HILL HIGH SCHOOL FOR INTERNATIONAL STUDIE,20082009,86.1,428,30.8,3.0,13.8,18.0,61.2,6.5,44.9,55.1,87.0,73.09999999999998,18.5,54.6,13.9,9.3,3.7
10X546,BRONX THEATRE HIGH SCHOOL,20082009,77.1,415,7.5,10.6,0.5,35.2,61.9,2.4,27.7,72.3,58.0,30.0,3.0,27.0,28.0,25.0,16.0
10X549,DISCOVERY HIGH SCHOOL,20082009,77.7,448,14.7,19.2,2.0,27.0,69.4,0.7,48.7,51.3,61.5,29.7,4.4,25.3,31.9,26.4,8.8
10X696,HIGH SCHOOL OF AMERICAN STUDIES AT LEHMAN COLLEG,20082009,25.3,346,,1.2,13.9,18.8,25.1,41.0,55.5,44.5,94.3,94.3,90.8,3.4,0.0,5.7,0.0
11X249,BRONX HEALTH SCIENCES HIGH SCHOOL,20082009,71.8,354,9.3,8.8,5.6,48.0,44.1,0.6,30.5,69.5,80.3,71.8,7.0,64.8,8.5,5.6,14.1
11X253,BRONX HIGH SCHOOL FOR WRITING AND COMMUNICATION,20082009,75.0,450,5.1,13.6,1.8,52.7,43.6,1.3,39.3,60.7,67.7,25.8,0.0,25.8,41.9,17.2,14.0
11X265,BRONX LAB SCHOOL,20082009,78.8,423,6.9,11.1,1.9,41.6,55.6,0.9,53.9,46.1,85.7,50.0,0.0,50.0,35.7,12.2,2.0
11X275,HIGH SCHOOL OF COMPUTERS AND TECHNOLOGY,20082009,78.6,490,5.9,13.3,3.3,38.6,56.3,1.0,81.6,18.4,87.1,52.9,52.9,0.0,34.1,10.6,2.4
11X288,COLLEGIATE INSTITUTE OF MATH AND SCIENCE,20082009,66.1,463,2.6,11.0,6.5,38.4,47.1,6.9,53.8,46.2,82.4,69.2,20.9,48.4,13.2,16.5,1.1
11X290,BRONX ACADEMY OF HEALTH CAREERS,20082009,69.7,483,4.6,14.1,3.3,53.2,40.4,1.7,26.7,73.3,58.8,52.5,6.3,46.3,6.3,25.0,15.0
11X299,ASTOR COLLEGIATE ACADEMY,20082009,62.0,439,7.3,16.2,3.6,41.7,42.8,10.9,55.4,44.6,83.2,32.6,5.3,27.4,50.5,16.8,0.0
11X415,CHRISTOPHER COLUMBUS HIGH SCHOOL,20082009,60.5,1462,18.1,22.2,5.7,35.0,47.8,10.1,59.1,40.9,34.6,15.9,0.0,15.9,18.7,38.6,21.3
11X418,BRONX HIGH SCHOOL FOR THE VISUAL ARTS,20082009,68.7,367,5.4,21.0,1.1,38.7,52.3,7.9,57.5,42.5,61.5,26.0,1.0,25.0,35.4,20.8,6.3
11X455,HARRY S TRUMAN HIGH SCHOOL,20082009,40.9,2372,7.1,23.1,2.2,55.3,40.5,0.9,57.8,42.2,52.7,41.9,0.1,41.8,10.7,27.2,15.5
11X513,NEW WORLD HIGH SCHOOL,20082009,82.7,274,74.1,0.4,6.2,8.4,72.6,12.0,47.1,52.9,77.9,46.5,19.8,26.7,31.4,18.6,2.3
11X514,SPORTS PROFESSIONS HIGH SCHOOL,20082009,57.3,330,10.9,19.7,1.2,40.3,55.8,2.1,79.1,20.9,77.2,26.6,2.5,24.1,50.6,20.3,1.3
11X541,GLOBAL ENTERPRISE HIGH SCHOOL,20082009,74.1,457,13.6,16.2,2.2,39.4,54.7,2.6,58.0,42.0,48.9,12.5,0.0,12.5,36.4,36.4,14.8
11X542,PELHAM PREPARATORY ACADEMY,20082009,63.5,478,2.3,8.8,4.0,41.0,42.5,5.9,45.6,54.4,85.6,60.8,16.5,44.3,24.7,6.2,7.2
11X544,HIGH SCHOOL FOR CONTEMPORARY ARTS,20082009,79.5,463,9.9,19.2,2.2,43.8,51.2,0.6,50.5,49.5,85.2,70.4,23.5,46.9,14.8,9.9,4.9
11X545,BRONX AEROSPACE ACADEMY,20082009,77.7,405,18.3,17.5,2.2,28.9,66.7,2.0,82.0,18.0,97.3,58.9,0.0,58.9,38.4,1.4,1.4
12X262,BRONX HIGH SCHOOL FOR PERFORMANCE & STAGECRAFT,20082009,80.6,409,7.1,19.3,1.2,46.0,51.3,0.7,18.8,81.2,44.4,22.2,0.0,22.2,22.2,37.0,18.5
12X271,EAST BRONX ACADEMY FOR THE FUTURE,20082009,79.7,620,10.0,20.8,1.6,33.4,63.5,1.5,54.4,45.6,70.1,25.4,1.5,23.9,44.8,17.9,11.9
12X278,PEACE AND DIVERSITY ACADEMY,20082009,72.2,337,7.7,11.9,2.1,32.3,62.0,2.4,47.5,52.5,60.2,60.2,0.0,60.2,0.0,34.9,4.8
12X480,BRONX REGIONAL HIGH SCHOOL,20082009,76.4,366,6.0,10.1,0.3,49.7,48.4,1.1,41.5,58.5,27.3,3.6,0.0,3.6,23.6,62.7,10.0
12X550,HIGH SCHOOL OF WORLD CULTURES,20082009,90.6,292,89.7,0.0,6.2,6.5,86.6,0.3,49.7,50.3,68.9,52.5,3.3,49.2,16.4,26.2,4.9
12X680,BRONX COALITION COMMUNITY HIGH SCHOOL,20082009,80.4,289,7.6,19.0,2.8,32.2,64.0,1.0,72.7,27.3,43.1,13.7,0.0,13.7,29.4,31.4,15.7
12X682,FANNIE LOU HAMER FREEDOM HIGH SCHOOL,20082009,81.1,501,10.4,25.3,1.0,32.5,66.1,0.2,49.3,50.7,67.7,58.1,0.0,58.1,9.7,18.3,9.7
12X684,WINGS ACADEMY,20082009,74.0,532,7.0,18.2,2.1,47.6,48.1,0.4,50.4,49.6,53.5,36.4,3.9,32.6,17.1,32.6,9.3
12X690,MONROE ACADEMY FOR BUSINESS/LAW,20082009,77.7,523,13.0,15.5,0.6,28.7,69.4,0.8,55.1,44.9,44.1,27.9,1.8,26.1,16.2,34.2,20.7
12X692,MONROE ACADEMY FOR VISUAL ARTS,20082009,74.8,498,27.3,20.3,1.6,22.5,74.3,1.0,50.2,49.8,37.2,29.1,3.5,25.6,8.1,43.0,18.6
13K265,JHS 265 SUSAN S. MCKINNEY,20082009,64.6,546,2.4,15.0,1.3,77.3,19.2,1.3,39.2,60.8,71.4,61.2,0.0,61.2,10.2,18.4,6.1
13K419,SCIENCE SKILLS CENTER HIGH SCHOOL FOR SCIENCE,20082009,54.4,956,3.8,8.4,5.5,81.1,11.6,1.3,59.2,40.8,67.6,49.4,2.8,46.6,18.2,25.6,5.7
13K430,BROOKLYN TECHNICAL HIGH SCHOOL,20082009,36.2,4662,0.0,0.6,57.4,13.1,8.0,21.0,58.2,41.8,92.3,92.3,84.0,8.2,0.0,6.8,0.4
13K439,BROOKLYN INTERNATIONAL HIGH SCHOOL,20082009,80.0,405,75.6,0.0,31.4,17.3,37.5,13.8,52.3,47.7,79.3,40.2,0.0,40.2,39.0,17.1,3.7
13K483,THE URBAN ASSEMBLY SCHOOL FOR LAW AND JUSTICE,20082009,59.4,450,1.3,10.7,1.8,80.4,16.9,0.4,26.9,73.1,89.5,67.4,0.0,67.4,22.1,9.3,0.0
13K499,ACORN COMMUNITY HIGH SCHOOL,20082009,76.3,740,3.1,14.1,1.5,81.8,14.3,0.8,52.4,47.6,69.0,44.2,4.4,39.8,24.8,22.1,5.3
13K509,FREEDOM ACADEMY HIGH SCHOOL,20082009,55.4,316,1.6,16.8,2.8,77.2,16.5,1.9,50.6,49.4,53.8,51.9,0.0,51.9,1.9,40.4,5.8
13K553,BROOKLYN ACADEMY HIGH SCHOOL,20082009,71.1,257,1.9,8.6,0.4,82.1,16.0,1.2,46.7,53.3,12.0,1.2,0.0,1.2,10.8,79.5,7.2
13K575,BEDFORD STUYVESANT PREPARATORY HIGH SCHOOL,20082009,70.1,115,0.0,3.5,0.0,81.7,14.8,0.9,50.4,49.6,31.5,9.3,0.0,9.3,22.2,61.1,7.4
13K595,BEDFORD ACADEMY HIGH SCHOOL,20082009,49.4,336,0.0,4.8,0.9,89.9,6.8,0.6,45.5,54.5,96.6,91.5,58.1,33.3,5.1,1.7,0.9
13K605,GEORGE WESTINGHOUSE CAREER AND TECHNICAL EDUCATI,20082009,56.1,917,2.0,14.5,2.1,74.8,19.8,2.0,67.9,32.1,52.7,17.4,5.0,12.4,35.3,22.4,11.6
13K670,BENJAMIN BANNEKER ACADEMY,20082009,50.7,865,0.0,3.8,2.7,83.7,11.1,1.4,39.3,60.7,91.6,87.8,56.7,31.1,3.8,5.5,2.9
14K071,JUAN MOREL CAMPOS SECONDARY SCHOOL,20082009,76.6,920,18.4,25.0,0.3,21.5,74.8,3.2,54.5,45.5,61.3,34.7,0.0,34.7,26.7,29.3,8.0
14K474,PROGRESS HIGH SCHOOL FOR PROFESSIONAL CAREERS,20082009,71.7,966,15.0,9.3,0.8,32.5,64.5,1.1,46.2,53.8,49.3,27.8,1.9,25.9,21.5,39.3,9.3
14K477,SCHOOL FOR LEGAL STUDIES,20082009,65.6,790,4.7,11.4,0.9,61.5,35.1,1.6,43.4,56.6,57.1,14.3,1.2,13.1,42.9,26.2,14.3
14K478,ENTERPRISE BUSINESS AND TECH HS,20082009,72.5,865,10.4,11.2,2.2,39.4,55.6,2.0,66.9,33.1,89.5,67.8,46.8,21.1,21.6,7.6,1.8
14K488,BROOKLYN PREPARATORY HIGH SCHOOL,20082009,61.2,384,1.3,15.1,0.8,73.2,23.2,2.1,44.0,56.0,96.4,85.5,7.3,78.2,10.9,1.8,1.8
